ID,App_Name,Genre,Price,User_Rating,Total_Reviews,User_Review
396,Hill Climb Racing,Racing,0,4.4,8921451,"fps dropped so low after almost everytime you updated it. the latest update works flawlessly but now, you ruined it. i noticed it everytime you announce an update. please dont change any graphic setting every update,"
397,Hitman Sniper,Action,$0.99 ,4.6,408292,Great game concept  with good graphics and some nice customization features. The gameplay against the AI is boring. The online play fun  if it works. The lag is killing the gameplay.
398,FRONTLINE COMMANDO: D-DAY,Action,0,4.5,1736105,This game is really good! The only problem is that the background can look really dull after a while.
399,Fruit Ninja,Arcade,0,4.3,5091448,Fairly addictive game. However there are soooooo many ads displayed. I understand that the developers need a source of income but it is getting out of control.
400,Crossy Road,Action,0,4.5,4229977," Simple graphics, perfect for a crappy mobile device like mine! Thanks!"
401,Temple Run 2,Action,0,4.3,8116142,This premium game does not have purchases that allow advancement  and the frequent content updates add great aspects of adventure to the game. Though online play may prove difficult  the game possesses features and complexity absent in all other games.
402,Beach Buggy Blitz,,0,4.2,640974,Classic  I love the concept behind the app. Hopefully new updates will soon change the whole game to a new experience.
